{
  "$id": "finding.schema.json",
  "$schema": "https://json-schema.org/draft/2020-12/schema",
  "title": "Finding",
  "type": "object",
  "additionalProperties": false,
  "required": ["id", "agent", "severity", "claim", "evidence", "recommendation", "confidence"],
  "properties": {
    "id": { "type": "string", "minLength": 1 },
    "agent": { "type": "string", "minLength": 1 },
    "severity": { "enum": ["info", "low", "medium", "high", "critical"] },
    "claim": { "type": "string", "minLength": 1 },
    "evidence": {
      "type": "array",
      "minItems": 1,
      "items": { "$ref": "evidence.schema.json" }
    },
    "recommendation": { "type": "string", "minLength": 1 },
    "confidence": { "type": "number", "minimum": 0, "maximum": 1 },
    "validation": {
      "type": "array",
      "items": { "type": "string", "minLength": 1 }
    },
    "tags": {
      "type": "array",
      "minItems": 1,
      "items": { "type": "string", "minLength": 1 },
      "uniqueItems": true
    },
    "cardType": { "enum": ["pattern", "flow", "decision", "warning"] },
    "audience": { "enum": ["coding-agent", "engineer", "maintainer"] },
    "whenToUse": { "type": "string", "minLength": 1 },
    "whenNotToUse": { "type": "string", "minLength": 1 },
    "risks": { "type": "string", "minLength": 1 },
    "adaptationNotes": { "type": "string", "minLength": 1 }
  }
}
